{
  "$schema": "https://raw.githubusercontent.com/danil-labs/agent-creator/v1/schema/agent.v1.json",
  "specVersion": 1,
  "id": "dafbf4f7-6ae0-4455-9244-cbcda28f86a7",
  "scope": "shared",
  "version": "1.0.0",
  "memory": { "reach": "agent", "store": "local" },
  "permissions": { "ceiling": "ask", "tools": ["read", "execute"] }
}
