{
  "$schema": "https://raw.githubusercontent.com/danil-labs/agent-creator/v1/schema/agent.v1.json",
  "specVersion": 1,
  "id": "c37cf26c-3407-4d62-b91e-6c8560ea94f0",
  "scope": "repository",
  "memory": {
    "reach": "project"
  },
  "extensions": {
    "terminus": {
      "version": 1
    }
  }
}
