{
  "$schema": "https://raw.githubusercontent.com/danil-labs/agent-creator/v1/schema/agent.v1.json",
  "specVersion": 1,
  "id": "4a2f8f1e-a749-4565-83cd-5d0a2406b959",
  "scope": "shared",
  "version": "1.1.0",
  "memory": {
    "reach": "agent",
    "store": "local"
  },
  "skills": [
    "skills/user-stories"
  ],
  "permissions": {
    "ceiling": "read-only",
    "tools": [
      "read",
      "mcp"
    ]
  },
  "requires": {
    "mcp": [
      {
        "slot": "issue-tracker",
        "access": "read",
        "why": "Reads the issues linked from the stories under review"
      }
    ]
  }
}
