{
  "$schema": "https://raw.githubusercontent.com/danil-labs/agent-creator/v1/schema/agent.v1.json",
  "specVersion": 1,
  "id": "947ebae9-4a98-4133-823c-e5894a7b5482",
  "scope": "shared",
  "version": "1.0.0",
  "memory": {
    "reach": "agent",
    "store": "local"
  },
  "skills": [
    "skills/user-stories"
  ],
  "permissions": {
    "ceiling": "ask",
    "tools": [
      "read",
      "edit"
    ]
  }
}
