{
  "$schema": "https://raw.githubusercontent.com/danil-labs/agent-creator/v1/schema/agent.v1.json",
  "specVersion": 1,
  "id": "6593c913-2cd4-49a9-a428-4b120943a692",
  "scope": "shared",
  "version": "1.1.0",
  "memory": { "reach": "agent", "store": "local" },
  "skills": ["skills/create-agent"],
  "permissions": { "ceiling": "ask", "tools": ["read", "edit", "execute"] }
}
